id,nama,harga,fasilitas
1,Paket Pernikahan Basic,300000,"Foto pre-wedding, Dekorasi sederhana, Penyewaan tenda, Kursi dan meja, Konsultasi pernikahan"
2,Paket Pernikahan Silver,400000,"Foto pre-wedding dan on the day, Dekorasi dengan tema pilihan, Catering untuk 100 orang, Sound system, MC profesional"
3,Paket Pernikahan Gold,500000,"Foto pre-wedding dan on the day, Dekorasi mewah dengan bunga segar, Catering untuk 150 orang, Sound system dan lighting, Penyewaan gaun pengantin, Paket spa untuk pengantin"
4,Paket Pernikahan Platinum,750000,"Foto pre-wedding dan on the day, Dekorasi lengkap dengan tema, Catering untuk 200 orang, Live music, Penyewaan gaun dan tuxedo, Paket honeymoon, Dokumentasi video"
5,Paket Pernikahan Diamond,1000000,"Foto pre-wedding dan on the day dengan fotografer terkenal, Dekorasi premium, Catering untuk 300 orang dengan menu pilihan, Sound system dan lighting canggih, Live band, Paket spa dan kecantikan untuk pengantin, Penyewaan mobil mewah"
